{
  "schema_version": "1.0.0",
  "document_type": "inspection",
  "id": "insp_1111111111111111",
  "property": {
    "id": "prop_1111111111111111",
    "display_name": "Anonymizovaný rodinný dom – minimálny fixture",
    "property_type": "house",
    "location": {
      "country_code": "SK",
      "region": "Banskobystrický kraj"
    }
  },
  "inspection": {
    "property_id": "prop_1111111111111111",
    "inspection_type": "initial",
    "performed_at": "2026-06-03T09:00:00+02:00",
    "processing_status": "normalized",
    "scope": ["Vizuálna kontrola dostupných častí exteriéru."],
    "limitations": ["Kontrola bola nedeštruktívna."],
    "actor_ids": ["inspector_minimal"],
    "provenance": {
      "source_kind": "manual",
      "source_system": "DoktorHaus manual intake",
      "source_inspection_id": "MIN-2026-001",
      "imported_at": "2026-06-03T12:00:00+02:00"
    }
  },
  "actors": [
    {
      "id": "inspector_minimal",
      "display_name": "Inšpektor DoktorHaus",
      "role": "inspector"
    }
  ],
  "observations": [
    {
      "id": "obs_1111111111111111",
      "display_code": "OBS-001",
      "inspection_id": "insp_1111111111111111",
      "statement": "Koniec dažďového zvodu je vyústený tesne pri obvodovej stene.",
      "type": "visual",
      "area": {
        "area_type": "exterior",
        "label": "severná obvodová stena pri zvode",
        "orientation": "sever"
      },
      "status": "active",
      "provenance": {
        "source_kind": "manual",
        "source_system": "DoktorHaus manual intake",
        "source_inspection_id": "MIN-2026-001",
        "source_item_id": "OBS-001",
        "imported_at": "2026-06-03T12:00:00+02:00"
      },
      "observed_at": "2026-06-03T09:10:00+02:00",
      "observed_by": "inspector_minimal",
      "limitations": []
    }
  ],
  "evidence": [
    {
      "id": "ev_1111111111111111",
      "display_code": "EV-001",
      "inspection_id": "insp_1111111111111111",
      "type": "note",
      "title": "Terénna poznámka k vyústeniu zvodu",
      "description": "Poznámka zachytáva polohu konca zvodu pri stene bez tvrdenia o príčine poškodenia.",
      "captured_at": "2026-06-03T09:10:00+02:00",
      "captured_by": "inspector_minimal",
      "provenance": {
        "source_kind": "manual",
        "source_system": "DoktorHaus manual intake",
        "source_inspection_id": "MIN-2026-001",
        "source_item_id": "NOTE-001",
        "imported_at": "2026-06-03T12:00:00+02:00"
      },
      "media_reference": "evidence/minimal/zvod-note.txt",
      "privacy": "client_private",
      "status": "active",
      "content_type": "text/plain"
    }
  ],
  "observation_evidence_links": [
    {
      "id": "rel_1111111111111111",
      "observation_id": "obs_1111111111111111",
      "evidence_id": "ev_1111111111111111",
      "role": "documents",
      "relevance_note": "Poznámka dokumentuje presnú polohu pozorovaného vyústenia.",
      "created_at": "2026-06-03T12:05:00+02:00",
      "created_by": "inspector_minimal",
      "status": "active"
    }
  ],
  "import_metadata": {
    "import_id": "import_1111111111111111",
    "imported_at": "2026-06-03T12:00:00+02:00",
    "source_hash": "1111111111111111111111111111111111111111111111111111111111111111",
    "source_system": "DoktorHaus manual intake",
    "source_inspection_id": "MIN-2026-001"
  },
  "created_at": "2026-06-03T12:00:00+02:00",
  "updated_at": "2026-06-03T12:05:00+02:00"
}
